{
  "$schema": "http://json-schema.org/draft-07/schema#",
  "$comment": "GENERATED by gui/schema-gen/derive_nf_config_schemas.py from config/provisioning.json + its source (ADR-0425). Do not edit; regenerate.",
  "title": "provisioning",
  "type": "object",
  "additionalProperties": false,
  "properties": {
    "port": {
      "type": "integer",
      "x-env-override": "PROVISIONING_PORT",
      "x-cpp-type": "unsigned short"
    },
    "sbi_bind_address": {
      "type": "string",
      "x-cpp-type": "std::string"
    },
    "metrics_bind_address": {
      "type": "string",
      "x-env-override": "PROVISIONING_METRICS_BIND_ADDRESS",
      "x-cpp-type": "std::string"
    },
    "advertised_ipv4": {
      "type": "string"
    },
    "orchestration_database_url": {
      "type": "string",
      "x-env-override": "PROVISIONING_ORCHESTRATION_DATABASE_URL",
      "x-cpp-type": "std::string",
      "x-sensitivity": "credential"
    },
    "charging_database_url": {
      "type": "string",
      "x-env-override": "PROVISIONING_CHARGING_DATABASE_URL",
      "x-cpp-type": "std::string",
      "x-sensitivity": "credential"
    },
    "db_pool_size": {
      "type": "integer",
      "x-env-override": "PROVISIONING_DB_POOL_SIZE",
      "x-cpp-type": "int"
    },
    "udr_base_url": {
      "type": "string"
    },
    "serving_plmn_id": {
      "type": "string"
    },
    "authentication": {
      "type": "object",
      "additionalProperties": false,
      "properties": {
        "method": {
          "type": "string"
        },
        "management_field": {
          "type": "string"
        },
        "initial_sqn": {
          "type": "string"
        }
      }
    },
    "network_profiles": {
      "type": "object",
      "additionalProperties": false,
      "properties": {
        "default": {
          "type": "object",
          "additionalProperties": false,
          "properties": {
            "snssais": {
              "type": "array",
              "items": {
                "type": "object",
                "additionalProperties": false,
                "properties": {
                  "sst": {
                    "type": "integer"
                  },
                  "sd": {
                    "type": "string"
                  }
                }
              }
            },
            "dnn": {
              "type": "string"
            },
            "ue_ambr": {
              "type": "object",
              "additionalProperties": false,
              "properties": {
                "uplink": {
                  "type": "string"
                },
                "downlink": {
                  "type": "string"
                }
              }
            }
          }
        }
      }
    }
  },
  "required": [
    "charging_database_url",
    "db_pool_size",
    "metrics_bind_address",
    "orchestration_database_url",
    "port",
    "sbi_bind_address"
  ],
  "x-config-file": "config/provisioning.json",
  "x-source": [
    "bss/provisioning"
  ],
  "x-apply": "restart",
  "x-review": [
    "advertised_ipv4: present in the file but no source line visibly reads it",
    "authentication: nested object shape inferred from current values (map-vs-struct meaning unverified; new keys refused until reviewed)",
    "network_profiles: nested object shape inferred from current values (map-vs-struct meaning unverified; new keys refused until reviewed)",
    "network_profiles.default: nested object shape inferred from current values (map-vs-struct meaning unverified; new keys refused until reviewed)",
    "network_profiles.default.snssais[]: nested object shape inferred from current values (map-vs-struct meaning unverified; new keys refused until reviewed)",
    "network_profiles.default.ue_ambr: nested object shape inferred from current values (map-vs-struct meaning unverified; new keys refused until reviewed)"
  ]
}
